{
  "$schema": "../../../schemas/grounding-set.schema.json",
  "format": "clinicalcraft/grounding-set@1",
  "suite": "grounding-v1",
  "split": "dev",
  "caseId": "new-onset-t2dm",
  "history": [
    {"id": "t2d-d-h01", "locale": "en", "text": "What's been bothering you?", "expect": ["hx-chief"]},
    {"id": "t2d-d-h02", "locale": "en", "text": "How often are you passing water?", "expect": ["hx-polyuria"]},
    {"id": "t2d-d-h03", "locale": "en", "text": "Are you very thirsty?", "expect": ["hx-polydipsia"]},
    {"id": "t2d-d-h04", "locale": "en", "text": "Any tummy pain or vomiting?", "expect": ["hx-ketosis-sx"]},
    {"id": "t2d-d-h05", "locale": "en", "text": "Any problems getting an erection?", "expect": ["hx-erectile"]},
    {"id": "t2d-d-h06", "locale": "en", "text": "Are you sleepy during the day?", "expect": ["hx-osa"]},
    {"id": "t2d-d-h07", "locale": "en", "text": "Have you noticed any frothy urine?", "expect": ["hx-urinary-other"]},
    {"id": "t2d-d-h08", "locale": "en", "text": "Have you ever been told your blood pressure was high?", "expect": ["hx-prior-bp"]},
    {"id": "t2d-d-h09", "locale": "en", "text": "Do you drink alcohol?", "expect": ["hx-alcohol"]},
    {"id": "t2d-d-h10", "locale": "en", "text": "Do you exercise?", "expect": ["hx-exercise"]},
    {"id": "t2d-d-h11", "locale": "en", "text": "What worries you most?", "expect": ["hx-ice-concerns"]},
    {"id": "t2d-d-h12", "locale": "en", "text": "What did you hope we could do today?", "expect": ["hx-ice-expect"]},
    {"id": "t2d-d-h13", "locale": "en", "text": "Do you like football?", "expect": []},
    {"id": "t2d-d-h14", "locale": "zh-CN", "text": "体重有变化吗？", "expect": ["hx-weightloss"]},
    {"id": "t2d-d-h15", "locale": "zh-CN", "text": "看东西模糊吗？", "expect": ["hx-vision"]},
    {"id": "t2d-d-h16", "locale": "zh-CN", "text": "手脚麻吗？", "expect": ["hx-neuro-sx"]},
    {"id": "t2d-d-h17", "locale": "zh-CN", "text": "爬楼梯胸闷吗？", "expect": ["hx-cardiac-sx"]},
    {"id": "t2d-d-h18", "locale": "zh-CN", "text": "手抖吗？", "expect": ["hx-thyroid-sx"]},
    {"id": "t2d-d-h19", "locale": "zh-CN", "text": "以前查过血糖吗？", "expect": ["hx-prior-glucose"]},
    {"id": "t2d-d-h20", "locale": "zh-CN", "text": "过敏吗？", "expect": ["hx-allergy"]},
    {"id": "t2d-d-h21", "locale": "zh-CN", "text": "吸过毒吗？", "expect": ["hx-drugs"]},
    {"id": "t2d-d-h22", "locale": "zh-CN", "text": "家里谁做饭？", "expect": ["hx-living"]},
    {"id": "t2d-d-h23", "locale": "zh-CN", "text": "这三个月药按时吃了吗？", "phase": "review", "expect": ["hx-rv-adherence"]},
    {"id": "t2d-d-h24", "locale": "zh-CN", "text": "你会弹吉他吗？", "expect": []},
    {"id": "t2d-d-n01", "locale": "en", "text": "No chest pain when you climb stairs?", "expect": ["hx-cardiac-sx"], "tags": ["negation"]},
    {"id": "t2d-d-n02", "locale": "zh-CN", "text": "没吸过毒吧？", "expect": ["hx-drugs"], "tags": ["negation"]}
  ],
  "exam": [
    {"id": "t2d-d-e01", "locale": "en", "query": "general inspection", "expect": "ex-general"},
    {"id": "t2d-d-e02", "locale": "en", "itemId": "ankle-reflexes", "expect": "ex-ankle-reflex"},
    {"id": "t2d-d-e03", "locale": "en", "query": "check visual acuity", "expect": "ex-visual-acuity"},
    {"id": "t2d-d-e04", "locale": "zh-CN", "query": "检查双足皮肤和趾甲", "expect": "ex-foot-inspect"},
    {"id": "t2d-d-e05", "locale": "zh-CN", "query": "甲状腺触诊", "expect": "ex-thyroid"}
  ],
  "orders": [
    {"id": "t2d-d-o01", "locale": "en", "query": "fasting glucose", "expect": "inv-fpg"},
    {"id": "t2d-d-o02", "locale": "en", "itemId": "lft", "expect": "inv-lft"},
    {"id": "t2d-d-o03", "locale": "en", "query": "kidney function and eGFR", "expect": "inv-renal"},
    {"id": "t2d-d-o04", "locale": "en", "query": "cortisol", "expect": null},
    {"id": "t2d-d-o05", "locale": "zh-CN", "query": "做个OGTT", "expect": "inv-ogtt"},
    {"id": "t2d-d-o06", "locale": "zh-CN", "query": "查乙肝两对半", "expect": "inv-hbv"},
    {"id": "t2d-d-n06", "locale": "zh-CN", "query": "查个TSH排除甲亢", "expect": "inv-tsh", "tags": ["negation"]}
  ],
  "interventions": [
    {"id": "t2d-d-i01", "locale": "en", "query": "dapagliflozin 10 mg", "expect": "iv-sglt2i"},
    {"id": "t2d-d-i02", "locale": "en", "itemId": "semaglutide", "expect": "iv-glp1ra"},
    {"id": "t2d-d-i03", "locale": "en", "query": "home BP monitoring", "expect": "iv-home-bp"},
    {"id": "t2d-d-i04", "locale": "en", "query": "start sitagliptin", "expect": null},
    {"id": "t2d-d-i05", "locale": "zh-CN", "query": "打乙肝疫苗", "expect": "iv-hbv-vaccine"},
    {"id": "t2d-d-i06", "locale": "zh-CN", "query": "阿司匹林100 mg每天", "expect": "iv-aspirin"},
    {"id": "t2d-d-n03", "locale": "en", "query": "hold off on medication — diet and exercise first", "expect": "iv-lifestyle-only", "tags": ["negation"]},
    {"id": "t2d-d-n04", "locale": "zh-CN", "query": "暂时不加胰岛素", "expect": null, "tags": ["negation"]},
    {"id": "t2d-d-n05", "locale": "en", "query": "don't prescribe the fenofibrate", "expect": null, "tags": ["negation"]}
  ],
  "verifier": [
    {"id": "t2d-d-v01", "locale": "en", "question": "How much are you drinking?", "used": ["hx-polydipsia"], "reply": "Three or four litres a day — mostly iced tea and cola from the office fridge.", "expect": "pass"},
    {"id": "t2d-d-v02", "locale": "en", "question": "How much are you drinking?", "used": ["hx-polydipsia"], "reply": "About six litres a day, mostly water.", "expect": "block", "kind": "number"},
    {"id": "t2d-d-v03", "locale": "en", "question": "Any medical problems?", "used": ["hx-pmh"], "reply": "Nothing serious. A check-up ultrasound two years ago said I had a fatty liver.", "expect": "pass"},
    {"id": "t2d-d-v04", "locale": "en", "question": "Any medical problems?", "used": ["hx-pmh"], "reply": "Nothing serious, apart from gout — I take allopurinol for it.", "expect": "block", "kind": "drug"},
    {"id": "t2d-d-v05", "locale": "zh-CN", "question": "以前查过血糖吗？", "used": ["hx-prior-glucose"], "reply": "去年单位体检说空腹血糖有点高，6点几，让我半年后复查，我没去。", "expect": "pass"},
    {"id": "t2d-d-v06", "locale": "zh-CN", "question": "以前查过血糖吗？", "used": ["hx-prior-glucose"], "reply": "去年体检空腹血糖是9点多。", "expect": "block", "kind": "number"},
    {"id": "t2d-d-v07", "locale": "zh-CN", "question": "有没有哮喘？", "used": [], "reply": "没有哮喘。", "expect": "block", "kind": "denial"},
    {"id": "t2d-d-n07", "locale": "en", "question": "Any nausea or tummy pain?", "used": ["hx-ketosis-sx"], "reply": "Yes, I've been feeling sick and my stomach hurts.", "expect": "block", "kind": "negation", "tags": ["negation"]},
    {"id": "t2d-d-n08", "locale": "zh-CN", "question": "看东西模糊吗？", "used": ["hx-vision"], "reply": "没有，看东西一直很清楚。", "expect": "block", "kind": "negation", "tags": ["negation"]},
    {"id": "t2d-d-n09", "locale": "en", "question": "Ever used recreational drugs?", "used": ["hx-drugs"], "reply": "No, never touched anything like that.", "expect": "pass", "tags": ["negation"]},
    {"id": "t2d-d-n10", "locale": "zh-CN", "question": "有没有恶心呕吐？", "used": ["hx-ketosis-sx"], "reply": "都没有，不恶心也不吐，就是累。", "expect": "pass", "tags": ["negation"]}
  ]
}
